Knowledge Centricity Grade,Grade description,Capabilities,Value delivered,Knowledge footprint
1,Inability to generate actionable knowledge,Required skills not existent internally. Lack of organizational will. Focus only on basic transactional functionality.,"Understanding on an ad hoc, post-mortem basis as to why it happened.",Little Knowledge infrastructure.
2,Knowledge silos within the organization,Business unit/function-centric knowledge creation. Lack of vision to action/compete on knowledge. Little or no information sharing across business units/functions.,Understanding of business and issues which must be addressed to improve individual business units/functions.,Analytical resources embedded in local functional teams.
3,Aspire to leverage knowledge,Desire to leverage knowledge driven from the top. Efforts underway to integrate / better understand internal knowledge capabilities.,"Ability to capture current conditions, attempt to understand future trends model in place.",Local knowledge delivery Model in place.
4,Knowledge-Driven business,"Centralized effort to understand business trends holistically. Knowledge creation, capture, and management key driver for people performance.",Ability to anticipate and adapt to changes in external/internal environments to obtain/retain competitive advantage analytical structure.,Central enterprise-wide knowledge structure.
5,Industry Knowledge Leader,Knowledge-driven innovation driving business growth. Employees are passionate and committed to analytics.,Generate consistent business value through insights to obtain competitive advantage; established analytical processes embedded in overall competition organization.,Well-established knowledge process embedded in the organization.
